{
  "schema_version": "1.3",
  "job_id": "job_demo",
  "status": "needs_review",
  "stage": "done",
  "progress": {
    "percent": 100,
    "message": "Готово: 3 варианта, у двух есть замечания аудита"
  },
  "template_id": "tpl_vk_education",
  "package_id": "pkg_demo",
  "request": {
    "schema_version": "1.2",
    "template_id": "tpl_vk_education",
    "package_id": "pkg_demo",
    "idempotency_key": "ui-7c1e2a",
    "settings": {
      "slide_count": {
        "min": 10,
        "max": 15
      },
      "language": "ru",
      "variants": [
        "compact",
        "balanced",
        "detailed"
      ],
      "generate_images": false,
      "run_contextual_audit": true,
      "force_regenerate": false,
      "seed": 42
    }
  },
  "created_at": "2026-09-15T12:00:00Z",
  "finished_at": "2026-09-15T12:04:10Z",
  "variants": [
    {
      "variant_id": "compact",
      "axis": "density",
      "value": "compact",
      "rationale": "Минимум текста, один факт на слайд",
      "status": "ready",
      "slide_count": 10,
      "audit_summary": {
        "issues_total": 0
      },
      "artifacts": {
        "pptx": "compact/r1/deck.pptx",
        "pdf": "compact/r1/deck.pdf",
        "html": "compact/r1/deck.html",
        "thumbnails": [
          {
            "slide_index": 0,
            "name": "compact/r1/thumbs/slide-01.png",
            "width_px": 1280,
            "height_px": 720
          },
          {
            "slide_index": 1,
            "name": "compact/r1/thumbs/slide-02.png",
            "width_px": 1280,
            "height_px": 720
          },
          {
            "slide_index": 2,
            "name": "compact/r1/thumbs/slide-03.png",
            "width_px": 1280,
            "height_px": 720
          },
          {
            "slide_index": 3,
            "name": "compact/r1/thumbs/slide-04.png",
            "width_px": 1280,
            "height_px": 720
          },
          {
            "slide_index": 4,
            "name": "compact/r1/thumbs/slide-05.png",
            "width_px": 1280,
            "height_px": 720
          },
          {
            "slide_index": 5,
            "name": "compact/r1/thumbs/slide-06.png",
            "width_px": 1280,
            "height_px": 720
          },
          {
            "slide_index": 6,
            "name": "compact/r1/thumbs/slide-07.png",
            "width_px": 1280,
            "height_px": 720
          },
          {
            "slide_index": 7,
            "name": "compact/r1/thumbs/slide-08.png",
            "width_px": 1280,
            "height_px": 720
          },
          {
            "slide_index": 8,
            "name": "compact/r1/thumbs/slide-09.png",
            "width_px": 1280,
            "height_px": 720
          },
          {
            "slide_index": 9,
            "name": "compact/r1/thumbs/slide-10.png",
            "width_px": 1280,
            "height_px": 720
          }
        ]
      },
      "revision": 1,
      "revisions": [
        {
          "revision": 1,
          "created_at": "2026-09-15T12:03:40Z",
          "pptx_hash": "sha256:…",
          "artifacts_prefix": "compact/r1/"
        }
      ],
      "composed_deck_artifact": "compact/r1/composed.json",
      "ready_at": "2026-09-15T12:03:40Z",
      "audited_at": "2026-09-15T12:04:10Z",
      "audit": {
        "status": "complete",
        "coverage_complete": true,
        "issues_total": 0,
        "blocking": 0,
        "report_artifact": "compact/r1/audit.json"
      },
      "stages": [
        {
          "stage": "plan",
          "variant_id": "compact",
          "status": "done",
          "duration_ms": 25000,
          "quota_wait_ms": 1800
        },
        {
          "stage": "compose",
          "variant_id": "compact",
          "status": "done",
          "duration_ms": 3000
        },
        {
          "stage": "export",
          "variant_id": "compact",
          "status": "done",
          "duration_ms": 14000
        },
        {
          "stage": "audit",
          "variant_id": "compact",
          "status": "done",
          "duration_ms": 30000,
          "quota_wait_ms": 4000
        }
      ],
      "plan_artifact": "compact/r1/plan.json"
    },
    {
      "variant_id": "balanced",
      "axis": "density",
      "value": "balanced",
      "rationale": "Средняя плотность",
      "status": "needs_review",
      "slide_count": 12,
      "audit_summary": {
        "issues_total": 2
      },
      "artifacts": {
        "pptx": "balanced/r1/deck.pptx",
        "pdf": "balanced/r1/deck.pdf",
        "html": "balanced/r1/deck.html",
        "thumbnails": [
          {
            "slide_index": 0,
            "name": "balanced/r1/thumbs/slide-01.png",
            "width_px": 1280,
            "height_px": 720
          },
          {
            "slide_index": 1,
            "name": "balanced/r1/thumbs/slide-02.png",
            "width_px": 1280,
            "height_px": 720
          },
          {
            "slide_index": 2,
            "name": "balanced/r1/thumbs/slide-03.png",
            "width_px": 1280,
            "height_px": 720
          },
          {
            "slide_index": 3,
            "name": "balanced/r1/thumbs/slide-04.png",
            "width_px": 1280,
            "height_px": 720
          },
          {
            "slide_index": 4,
            "name": "balanced/r1/thumbs/slide-05.png",
            "width_px": 1280,
            "height_px": 720
          },
          {
            "slide_index": 5,
            "name": "balanced/r1/thumbs/slide-06.png",
            "width_px": 1280,
            "height_px": 720
          },
          {
            "slide_index": 6,
            "name": "balanced/r1/thumbs/slide-07.png",
            "width_px": 1280,
            "height_px": 720
          },
          {
            "slide_index": 7,
            "name": "balanced/r1/thumbs/slide-08.png",
            "width_px": 1280,
            "height_px": 720
          },
          {
            "slide_index": 8,
            "name": "balanced/r1/thumbs/slide-09.png",
            "width_px": 1280,
            "height_px": 720
          },
          {
            "slide_index": 9,
            "name": "balanced/r1/thumbs/slide-10.png",
            "width_px": 1280,
            "height_px": 720
          },
          {
            "slide_index": 10,
            "name": "balanced/r1/thumbs/slide-11.png",
            "width_px": 1280,
            "height_px": 720
          },
          {
            "slide_index": 11,
            "name": "balanced/r1/thumbs/slide-12.png",
            "width_px": 1280,
            "height_px": 720
          }
        ]
      },
      "revision": 1,
      "revisions": [
        {
          "revision": 1,
          "created_at": "2026-09-15T12:03:40Z",
          "pptx_hash": "sha256:…",
          "artifacts_prefix": "balanced/r1/"
        }
      ],
      "composed_deck_artifact": "balanced/r1/composed.json",
      "ready_at": "2026-09-15T12:03:40Z",
      "audited_at": "2026-09-15T12:04:10Z",
      "audit": {
        "status": "partial",
        "coverage_complete": false,
        "issues_total": 2,
        "blocking": 0,
        "report_artifact": "balanced/r1/audit.json"
      },
      "stages": [
        {
          "stage": "plan",
          "variant_id": "balanced",
          "status": "done",
          "duration_ms": 25000,
          "quota_wait_ms": 1800
        },
        {
          "stage": "compose",
          "variant_id": "balanced",
          "status": "done",
          "duration_ms": 3000
        },
        {
          "stage": "export",
          "variant_id": "balanced",
          "status": "done",
          "duration_ms": 14000
        },
        {
          "stage": "audit",
          "variant_id": "balanced",
          "status": "done",
          "duration_ms": 30000,
          "quota_wait_ms": 4000
        }
      ],
      "plan_artifact": "balanced/r1/plan.json"
    },
    {
      "variant_id": "detailed",
      "axis": "density",
      "value": "detailed",
      "rationale": "Подробный вариант с таблицами",
      "status": "needs_review",
      "slide_count": 15,
      "audit_summary": {
        "issues_total": 3
      },
      "artifacts": {
        "pptx": "detailed/r1/deck.pptx",
        "pdf": "detailed/r1/deck.pdf",
        "html": "detailed/r1/deck.html",
        "thumbnails": [
          {
            "slide_index": 0,
            "name": "detailed/r1/thumbs/slide-01.png",
            "width_px": 1280,
            "height_px": 720
          },
          {
            "slide_index": 1,
            "name": "detailed/r1/thumbs/slide-02.png",
            "width_px": 1280,
            "height_px": 720
          },
          {
            "slide_index": 2,
            "name": "detailed/r1/thumbs/slide-03.png",
            "width_px": 1280,
            "height_px": 720
          },
          {
            "slide_index": 3,
            "name": "detailed/r1/thumbs/slide-04.png",
            "width_px": 1280,
            "height_px": 720
          },
          {
            "slide_index": 4,
            "name": "detailed/r1/thumbs/slide-05.png",
            "width_px": 1280,
            "height_px": 720
          },
          {
            "slide_index": 5,
            "name": "detailed/r1/thumbs/slide-06.png",
            "width_px": 1280,
            "height_px": 720
          },
          {
            "slide_index": 6,
            "name": "detailed/r1/thumbs/slide-07.png",
            "width_px": 1280,
            "height_px": 720
          },
          {
            "slide_index": 7,
            "name": "detailed/r1/thumbs/slide-08.png",
            "width_px": 1280,
            "height_px": 720
          },
          {
            "slide_index": 8,
            "name": "detailed/r1/thumbs/slide-09.png",
            "width_px": 1280,
            "height_px": 720
          },
          {
            "slide_index": 9,